route_id,route_family,current_status,verification_scope,evidence_anchor,currently_executable_resolved,future_scheme_space_exhausted,model_training_allowed_now,a100_training_allowed_now,missing_precondition,next_action
P154-ROUTE-001,first_paper_main_floor,verified_positive_narrow_scope,"fixed-sampling broad12/broad21 spot_size under broad_process_v1, seeds 7/1/2",docs/results/phase153_first_paper_contribution_refinement/phase153_first_paper_contribution_refinement_gate.json,true,false,false,false,none for first-paper draft; venue/literature still needed for submission,write/refine first paper around the narrow floor
P154-ROUTE-002,neural_operator_fno_dense_field,closed_diagnostic_no_operator_gap,"Phase 149 readiness, Phase 150 dense inventory, Phase 151 fixed-grid baseline review",docs/results/phase152_paper_evidence_neural_operator_route_closure/phase152_neural_operator_route_closure_table.csv,true,false,false,false,new leakage-safe dense target/split that strong baselines do not solve,do not train FNO/neural operators from current dense candidates
P154-ROUTE-003,registered_source_path_green_capl,closed_diagnostic_under_current_registration,"source-path, Green proxy, registered Layer Camera, G-code, and path-contact audits",docs/results/phase153_first_paper_contribution_refinement/phase153_claim_phrasing_guard_table.csv,true,false,false,false,stronger camera-to-galvo registration or new source-target target with guarded gap,do not tune the closed scalar proxy/path-contact branch
P154-ROUTE-004,microstructure_gnn_or_image_encoder,closed_diagnostic_alignment_or_stability_limit,"real-micro, region, patch embedding, and manuscript claim-boundary packages",docs/results/phase116_paper_evidence_consolidation/phase116_manuscript_claim_status_table.csv,true,false,false,false,physically stronger microstructure/thermal alignment or new benchmark source,do not claim microstructure GNN success from current evidence
P154-ROUTE-005,external_baseline_first_sources,sampled_sources_verified_or_closed_as_diagnostics,"Battery, Matbench, MPEA, glass/is-metal/perovskite-style baseline-first intakes",docs/results/phase116_paper_evidence_consolidation/phase116_manuscript_claim_status_table.csv,true,false,false,false,fresh public source with leakage-safe splits and strong-baseline-visible gap,new baseline-first source intake is allowed only as a new gated branch
P154-ROUTE-006,first_paper_submission,draft_allowed_submission_not_ready,Phase 153 contribution package plus open venue/literature gaps,docs/results/phase153_first_paper_contribution_refinement/phase153_first_paper_contribution_refinement_gate.json,false,false,false,false,target venue/author guide and benchmark literature verification,resolve writing evidence gaps before submission polish
P154-ROUTE-007,large_gpu_training_or_80gb,blocked_no_measured_need,all active gates keep A100/80GB locks false,docs/results/phase153_first_paper_contribution_refinement/phase153_first_paper_contribution_refinement_gate.json,true,false,false,false,seed-positive branch with measured 40GB memory/runtime bottleneck,do not request A100-SXM4-80GB
