candidate_id,candidate_family,source_name,source_url,source_type,public_reproducibility,registration_status,target_relevance,model_innovation_fit,allowed_next_gate,a100_training_allowed,a100_80gb_request_now,status,priority,stop_condition,next_action,evidence
P94-CAND-AMBNCH-PAD-REG,current_ambench_registration_followup,NIST AM-Bench / mds2-2716 pad thermography plus XYPT,https://data.nist.gov/od/id/mds2-2716,official_dataset_record,strong_existing_manifest,"pad thermography and pad XYPT exist, but current evidence has only independent-rescale diagnostics",highest for current manuscript and heat-kernel/source-path features,"registered heat-kernel, Green's-function, source-path features",data_registration_evidence_update_only,false,false,blocked_until_pad_registration_evidence,1,no documented pad camera-to-galvo mapping or equivalent registration,search or obtain pad camera-to-galvo registration metadata before feature/model work,Phase 81 preferred route remains blocked by missing paper-facing registration.
P94-CAND-PFHUB-PINN,external_physics_benchmark,PFHub phase-field benchmark problems,https://pages.nist.gov/pfhub/benchmarks/,official_benchmark_collection,public_benchmark_specs,synthetic_or_benchmark_registered_by_problem_definition,"supports mechanism testing, not a direct AM-Bench process-transfer replacement","Bayesian/adaptive PINN, Green's-function features, meta-learning quick adaptation precheck",phase95_local_synthetic_benchmark_design,false,false,open_for_local_design_gate,2,cannot preserve global/hot/gradient metrics on AM-Bench after synthetic success,build a local/no-training Phase 95 design gate for one PFHub-style physics benchmark,PFHub gives public physics benchmark definitions that can test model mechanisms before A100 validation.
P94-CAND-EXACA-SIM,simulation_augmented_target,ExaCA cellular-automata solidification code,https://github.com/LLNL/ExaCA,official_open_source_code,open_code_not_yet_project_data_card,requires_generated_dataset_and_alignment_card,possible microstructure/process augmentation after a source manifest is created,GCN or graph-conditioned process/microstructure branch after data-card gate,simulation_data_card_only,false,false,blocked_until_simulation_data_card,3,generated fields cannot be linked to AM-Bench process variables or strong baselines,create an ExaCA data-card proposal before any generated-data model training,"ExaCA is useful as a reproducible simulator, but no generated target table exists in this repo."
P94-CAND-EXT-THERMAL,external_registered_dataset,external public registered thermal/process dataset,,to_be_supplied,missing_source_manifest,missing_data_card,could become a second-paper or model-contribution route,"heat-kernel, GCN/attention, Bayesian PINN, or meta-learning only after intake",source_manifest_and_data_card_required,false,false,blocked_no_external_data_card,5,"private, non-reproducible, unregistered, or lacks process/physics targets",provide or identify a public dataset with source manifest and registration story,Phase 81 external route remains blocked without a source manifest.
P94-CAND-MANUSCRIPT,submission_track_dependency,target venue or accepted benchmark papers,,user_supplied_review_input,not_applicable_to_model_training,not_a_data_target,required for Phase 93 manuscript formatting and benchmark review,none; prevents fake venue-specific claims,benchmark_review_only,false,false,blocked_missing_target_benchmarks,0,"no target venue, author guide, or 3-10 benchmark papers","collect target venue or benchmark papers for Phase 93, separate from model exploration",Phase 92 status is blocked_missing_target_benchmarks.
