claim_id,claim_area,claim_status,allowed_use,wording_guard,evidence_anchor
P137-CLAIM-001,first_paper_main_claim,allowed_narrow_floor,main_text,claim only route-guarded fixed-sampling broad12/broad21 spot_size under broad_process_v1; do not generalize to full GNN-PINN or universal process conditioning,docs/results/phase116_paper_evidence_consolidation/phase116_positive_floor_table.csv
P137-CLAIM-002,external_data_branches,diagnostic_only,appendix_or_limitations,"external branches are closed diagnostics: battery_failure_databank, matbench_steels, matbench_expt_gap, matbench_phonons, matbench_dielectric, matbench_log_gvrh, matbench_log_kvrh, matbench_jdft2d, matbench_perovskites",docs/results/phase137_paper_evidence_refresh/phase137_external_diagnostic_refresh_table.csv
P137-CLAIM-003,not_allowed_claims,blocked,explicit_exclusions,"do not claim complete GNN-PINN, general process-condition modeling, density-invariant robustness, successful source-path/Green features, or successful microstructure GNN",docs/results/phase74_manuscript_v0_claim_audit/phase74_model_boundary_register.csv
P137-CLAIM-004,submission_readiness,blocked_missing_venue_benchmark,planning,submission readiness still requires target venue and benchmark-paper comparison,docs/results/phase116_paper_evidence_consolidation/phase116_remaining_blocker_table.csv
P137-CLAIM-005,phase116_floor_status,preserved,quality_gate,Phase 137 cannot strengthen claims beyond Phase 116 floor evidence,docs/results/phase116_paper_evidence_consolidation/phase116_paper_evidence_consolidation_gate.json
