route_id,phase,artifact,route_status,evidence_type,positive_signal,limitation_or_closure,paper_use,model_training_allowed,a100_training_allowed_now,a100_80gb_request_now,next_action
P176-ROUTE-001,phase169,docs/results/phase169_hidden_source_closure_identifiability_gate/phase169_hidden_source_closure_identifiability_gate.json,phase169_hidden_source_closure_identifiability_ready_phase170_low_budget_mechanism_design,no_training_synthetic_identifiability_positive,calibrated Bayesian hidden source/closure posterior beat grid_least_squares_source_closure_control by validation score gain 0.0707838724,synthetic inverse-heat only; no neural PINN training or AM-Bench evidence,second_paper_concept_positive,false,false,false,"use as calibrated identifiability evidence, not as trained PINN evidence"
P176-ROUTE-002,phase170,docs/results/phase170_hidden_closure_mechanism_smoke_design_gate/phase170_hidden_closure_mechanism_smoke_design_gate.json,phase170_hidden_closure_mechanism_smoke_design_ready_phase171_low_budget_smoke,design_only_mechanism_protocol,bounded mechanism package with 8 controls and 5 promotion rules,protocol only; no training executed in the phase,methods_guard_or_appendix_protocol,false,false,false,cite only as the gate that constrained Phase 171
P176-ROUTE-003,phase171,docs/results/phase171_hidden_closure_low_budget_smoke/phase171_hidden_closure_low_budget_smoke_gate.json,phase171_hidden_closure_low_budget_smoke_ready_phase172_trainable_design,numpy_low_budget_closure_positive,selected calibrated_hidden_source_closure_parameter_head over posterior_only_calibrated_bayesian_no_neural with validation gain 0.0011359227 and seed stability 1.0,small NumPy synthetic closure head; not Bayesian neural inference or AM data,second_paper_supporting_positive,false,false,false,write as bounded explicit closure recovery evidence
P176-ROUTE-004,phase172,docs/results/phase172_trainable_hidden_closure_smoke_design_gate/phase172_trainable_hidden_closure_smoke_design_gate.json,phase172_trainable_hidden_closure_smoke_design_ready_phase173_low_budget_trainable_smoke,design_only_trainable_smoke_protocol,candidate route tiny_explicit_latent_hidden_closure_smoke opened only a bounded Phase 173 smoke,design-only; no model result,appendix_protocol,false,false,false,cite only as route-control evidence
P176-ROUTE-005,phase173,docs/results/phase173_trainable_hidden_closure_low_budget_smoke/phase173_trainable_hidden_closure_low_budget_smoke_gate.json,phase173_trainable_hidden_closure_low_budget_smoke_ready_phase174_low_capacity_hidden_closure_design,tiny_explicit_latent_synthetic_positive,"selected tiny_explicit_latent_hidden_closure_smoke over uniform_grid_latent_trainable_control with validation gain 0.0166680534, test reversal ratio 0.5605813176, and seed stability 1.0","tiny synthetic trainable-latent smoke; not full PINN, not AM-Bench, not GNN/CNN/operator",second_paper_candidate_core_synthetic_positive,false,false,false,preserve as the strongest branch result before redesign
P176-ROUTE-006,phase174,docs/results/phase174_low_capacity_hidden_closure_design_gate/phase174_low_capacity_hidden_closure_design_gate.json,phase174_low_capacity_hidden_closure_design_ready_phase175_low_capacity_smoke,design_only_low_capacity_expansion_protocol,candidate route low_capacity_explicit_latent_hidden_closure_head was properly controlled before Phase 175,design-only; later Phase 175 did not validate the expansion,appendix_protocol,false,false,false,do not treat as model success
P176-ROUTE-007,phase175,docs/results/phase175_low_capacity_hidden_closure_smoke/phase175_low_capacity_hidden_closure_smoke_gate.json,phase175_low_capacity_hidden_closure_smoke_closed_no_incremental_gain,low_capacity_expansion_closure_negative,none; validation selected phase173_tiny_explicit_latent_hidden_closure_smoke instead of low_capacity_explicit_latent_hidden_closure_head,"closed by -0.0004223396 validation gain, test reversal 1.0307333811, seed stability 0.3333333333; blockers validation_selected_control_variant;validation_gain_vs_best_control;phase173_validation_score_gain_guard;phase173_test_score_gain_guard;phase173_test_closure_gain_guard;test_reversal_vs_best_control;seed_stability_guard",route_closure_or_limitations,false,false,false,do not retune the same low-capacity head
